"ONYAS, WINFRED ","SOJOURNER, GRACE","NAKINTU, MARIAH N.",,,,,ENTREPRENEURIAL SYNERGIES AND FRUGAL INNOVATION IN UGANDAN COMMUNITIES,"19 - Social, Frugal and BoP Innovation","Entrepreneurs in developing contexts often engage in frugal innovation practices (i.e.
inventions, adoptions, adaptations, appropriations and/ or transformations; Gewald et al,
2012: 3) to cope with the widespread resource challenges encountered. Dominated by
examples from India and those initiated by multinationals (e.g. Unilever’s washing
powder sachets; van Beers et al, 2012), the frugal innovation literature is sparse on the
frugal innovations initiated by local entrepreneurs in developing countries such as
Uganda. In this paper, we direct attention to the synergies that entrepreneurs enact by
integrating the multiple social and business ventures owned to create opportunities for
sustainable frugal innovation. The role of entrepreneurs in creating synergies enabling
frugal innovations is unexplored.
Drawing from the market studies approach, this study attends to frugal innovation as an
ongoing process; as an outcome of highly specific and concrete everyday practices
performed by human and non-human actors (cf. Kjellberg and Helgesson, 2006). We
examine the everyday frugal innovation practices of entrepreneurs who integrate multiple
business and social ventures in Uganda, and ask 3 questions: how do entrepreneurs
synergise multiple ventures to foster frugal innovations? What motivates these practices?
What challenges are encountered in the process, and how can these be addressed? To
address these questions, we take a qualitative multi-case study approach and draw on
material gathered in 2016-2017 in 3 contexts: waste management, sustainable energy and
HIV advocacy.
Our contribution is 3-fold. First, we address a concern that the participation of local
actors in frugal innovation practices is trivialised (Mwangi and Rutte, 2012). We do this
by foregrounding the critical role played by entrepreneurs in: translating models and
ideas from diverse contexts into frugal solutions, assembling local resources to develop
frugal solutions, and creating markets for frugal products. We build on the frugal
innovation literature, highlighting the qualities that local actors develop (and the
conditions needed) to enable their active participation in synergistically enacting frugal
innovations.
Secondly, this paper contributes to the embryonic market studies research on developing
contexts, which has heretofore focused on market innovation, agencing, framing and the
formation of markets. Frugal innovation market practices remain unexplored in this body
of work.
Finally, we empirically illuminate the distinctive frugal innovation practices unfolding in
an African context, addressing a gap in a field dominated by research on India. The paper
raises implications for practice for the enhancement of MSE and community-led frugal
3
innovations. It calls for infrastructural support to local frugal innovators, and for the
development of policies that are reflective of local contexts.","Basu, R.R., Banerjee, P.M. and Sweeny, E.G., 2013. Frugal innovation: core
competencies to address global sustainability. Journal of Management for Global
sustainability, 1(2), pp.63-82.","Ahmed, H. (2011). Maqasid al-Shari’ah and Islamic financial products: a framework for assessment. ISRA International journal of Islamic finance, 3(1), 149-160.","Ahmed, H. (2014). Islamic banking and Shari’ah compliance: a product development perspective. Journal of Islamic finance., 3(2), 15-29.","Bangsa, A. B. Product Development in Islamic Banks. Journal of Indonesian Economy and Business, 30(3), 288-291.","Karim, R. A. A., & Archer, S. (Eds.). (2002). Islamic finance: innovation and growth. Euromoney books and AAOIFI.","Khan, M. A. (2013). What is wrong with islamic economics?: analysing the present state and future agenda. Edward Elgar Publishing.","Al-Amine, M. A. B. (2015). Product development and Maqāṣid in Islamic finance: towards a balanced methodology. IRTI Working Paper","Naser, K., & Moutinho, L. (1997). Strategic marketing management: the case of Islamic banks. International Journal of Bank Marketing, 15(6), 187-203.","Nienhaus, V. (2011). Islamic finance ethics and Shari’ah law in the aftermath of the crisis: Concept and practice of Shari’ah compliant finance. Ethical Perspectives, 18(4), 591-623.",,,,,,,,,,,,,,,,,,,,,,,,,,,,,,,,,,,,,,,,,,,,,,,,,,,,,,,,,,,,,,,,,,,,,,,,,,,,,,,,,,,,,,,,,,,,,,
"SUK PARK, JIN","SUZUKI, SATOKO",,,,,,THE IMPACT OF PERCEIVED CREATIVITY IN NEW PRODUCT DEVELOPMENT ON EMPLOYEES’ JOB ATTITUDES,01. Creativity in New Product Development,"In this paper, we extend the conventional point of view interpreting the perceived creativity of new products by adopting an interdisciplinary approach to establish comprehensive explanation from marketing literature as well as organization studies. It has been discussed that a perceived product creativity can influence consumers’ purchasing behaviors, and we show that such influence of product creativity is also observed in the organizational behaviors. A group of internal stakeholders who would be directly affected by the product creativity is a new product development team as it is the principal agent of the process, which is also this paper’s context.
We draw on two dimensions of product creativity – novelty and meaningfulness – from the new product development studies (Im & Workman Jr, 2004; Rubera, Ordanini, & Griffith, 2011) to define the perceived product creativity. According to argument that novelty represents the exploration whereas meaningfulness is for exploitation (March, 1991), we hypothesize that there would be two parallel paths in the relationship between perceived product creativity and new product development team’s performance. One path starts from novelty, then the exploratory attitudes of team members will be formed, and finally a new product performance is observed. Another path starts from meaningfulness, then the exploitative attitudes of team members will be formed, and finally the performance.
A survey study was conducted to investigate the association between perceived product creativity and team members’ attitudes in the context of new product development. We collected data from 274 individual respondents from 43 Japanese companies working on the new product development. The results of team-level analysis with 44 teams in a structural equation model showed the framework assuming the
separation of two paths (i.e., exploration and exploitation): product novelty led to the influencing attitude of employees and the increased attention to market potential, whereas product meaningfulness led to the conflict avoidance and focus on trust within team. We also observed several positive outcomes – increased team performance and team satisfaction – in this two-path model.
The major contribution of these findings is the implication that perceived product creativity is also working for employees’ attitudes and not just for customers. Future study should consider introducing organizational identity theory (Ashforth, Harrison, & Corley, 2008) to further explore the mechanisms bridging the product level creativity and employees’ attitudes.","Ashforth, B. E., Harrison, S. H., & Corley, K. G. 2008. Identification in organizations: an examination of four fundamental questions. Journal of Management, 34(3): 325-374.","Covin, Jeffrey G. and Dennis P. Slevin. 1991. A Conceptual Model of Entrepreneurship as Firm Behavior. Entrepreneurship Theory and Practice 16 (1): 7–26.","Kester, Linda, Abbie Griffin, Erik J. Hultink, and Kristina Lauche. 2011. Exploring Portfolio Decision-Making Processes. Journal of Product Innovation Management 28 (5): 641–661.","Kleinschmidt, Elko J., Ulrike de Brentani, and Sören Salomo. 2007. Performance of Global New Product Development Programs: A Resource-Based View. Journal of Product Innovation Management 24 (5): 419–441","Kock, Alexander, Wilderich Heising, and Hans G. Gemünden. 2015. How Ideation Portfolio Management Influences Front-End Success. Journal of Product Innovation Management 32 (4): 539–555.","Myers, Stewart C. 1977. Determinants of corporate borrowing. Journal of Financial Economics 5 (2): 147–175.","Rauch, Andreas, Johan Wiklund, G. T. Lumpkin, and Michael Frese. 2009. Entrepreneurial Orientation and Business Performance: An Assessment of Past Research and Suggestions for the Future. Entrepreneurship Theory and Practice 33 (3): 761–787.","Reuer, J. J. and Tony W. Tong. 2007. Real options theory. Bingley, U.K: Emerald.","Rosenbusch, Nina, Andreas Rauch, and Andreas Bausch. 2013. The Mediating Role of Entrepreneurial Orientation in the Task Environment–Performance Relationship. Journal of Management 39 (3): 633–659.","Schultz, Carsten, Søren Salomo, Ulrike de Brentani, and Elko J. Kleinschmidt. 2013. How Formal Control Influences Decision-Making Clarity and Innovation Performance. Journal of Product Innovation Management 30 (3): 430–447.","Schultz, Carsten, Søren Salomo, and Katrin Talke. 2013. Measuring New Product Portfolio Innovativeness: How Differences in Scale Width and Evaluator Perspectives Affect its Relationship with Performance. Journal of Product Innovation Management 30 (1): 93–109","Talke, Katrin, Søren Salomo, and Alexander Kock. 2011. Top Management Team Diversity and Strategic Innovation Orientation: The Relationship and Consequences for Innovativeness and Performance. Journal of Product Innovation Management 28 (6): 819–832.",,,,,,,,,,,,,,,,,,,,,,,,,,,,,,,,,,,,,,,,,,,,,,,,,,,,,,,,,,,,,,,,,,,,,,,,,,,,,,,,,,,,,,,,,,,
"PARKER-STRAK, RACHEL ","BARNES, LIZ","STUDD, RACHEL","DOYLE, STEPHEN",,,,DISRUPTION OF THE PRODUCT DEVELOPMENT PROCESS WITHIN ONLINE FAST FASHION RETAILERS.,03 - Emerging and Early Research (Young Scholars Track),"The UK fashion industry has changed in the last twenty-five years with the introduction and development of new technologies, extended supply chains coupled with outsourcing, increased consumer demands and changing consumer behaviour. These changes have disrupted many business models within the fashion supply chain for example in the areas of consumer expectations, retail formats, product assortment, speed to market and manufacturing (Barnes & Lea-Greenwood 2006; Christopher et al. 2004; Doyle et al. 2006; Goworek 2014; McCormick et al. 2014; Tyler et al. 2006) Given the scale and significance of the fashion sector, coupled with the changes previously mapped out, it is appropriate to note that there is limited research in the field of Fashion Product Development (FPD) with relatively few theoretical models that support the process (d’Avolio et al. 2015; Goworek 2010; Pechoux et al. 2004; Moretti & Braghini Junior 2017; Silva & Rupasinghe 2016). The existing models however are linear, not specific to business type and do not consider the changes and challenges in contemporary UK High Street fashion sector.
This research critically investigates product development in the context of UK fast fashion online retailers who are developing ‘own label’ fashion clothing. In so doing, the research places considerable focus upon inputs, outputs, planning and management in order to map comprehensively the interplay of people, processes and procedures of product development adopted.
Goworek (2010) proposed that to work effectively, fashion product development processes involve co-operation rather than mere co-ordination, mirroring practice in the domain of engineering design as suggested in the work of Boujut and Laureillard,
(2000). This idea has formed the basis of this research, applying theories from New Product Development (Cooper & Kleinschmidt 1995; Hart 1996; Johne & Snelson 1988; Krishnan & Ulrich 2001), Project Management (Clelands & Ireland 2002; Lock 2013; Major 2010; Packendorff 1995; Soderlund 2004) and Fashion Product Development to identify any parallels, similarities and gaps to establish the contribution. The research adopts a qualitative research approach with key informants from the fashion industry to examine product development from a project management and new product development perspective. The major findings of this research demonstrates a process model more appropriate for contemporary and challenging fashion retailing and specific to online fast fashion businesses. It also identifies the links and parallels from New Product Development (NPD) process model structures and Project Management (PM) business approaches and theories. This research explores the necessity of product development theoretical models that are specific to business and retail type within the fashion industry and contributes to the nascent theory specifically on fashion product development. This research aims to challenge the traditional Fashion Product Development Process and presents a new model more reflective of the context in which the business model is focused with a more robust management underpinning derived from the project management and new product development literature.","Barnes, L. & Lea-Greenwood, G., 2006. Fast fashioning the supply chain: shaping the research agenda. Journal of Fashion Marketing and Management, 11, pp.571–586.","Caetano, Mauro, et Daniel C. Amaral. 2011. « Roadmapping for Technology Push and
Partnership: A Contribution for Open Innovation Environments ». Technovation 31 (7):
320-35. https://doi.org/10.1016/j.technovation.2011.01.005.","Faulkner, Philip, et Jochen Runde. 2009. « On the Identity of Technological Objects and User
Innovations in Function ». Academy of Management Review 34 (3): 442-62.
https://doi.org/10.5465/amr.2009.40632318.","Gillier, Thomas, et Gerald Piat. 2011. « Exploring Over: The Presumed Identity of Emerging
Technology: THE PRESUMED IDENTITY OF EMERGING TECHNOLOGY ». Creativity and
Innovation Management 20 (4): 238-52. https://doi.org/10.1111/j.1467-8691.2011.00614.x.","Glaser, Markus, et Bert Miecznik. 2009. « TRIZ for Reverse Inventing in Market Research: A
Case Study from WITTENSTEIN AG, Identifying New Areas of Application of a Core
Technology ». Creativity and Innovation Management 18 (2): 90-100.
https://doi.org/10.1111/j.1467-8691.2009.00516.x","Hatchuel, Armand, et Benoît Weil. 2003. « A New Approach of Innovative Design: An
Introduction to C-K Theory ». In . International Conference on Engineering Design,
Stockholm.","Heiss, M., et J. Jankowsky. 2001. « The Technology Tree Concept-an Evolutionary Approach to
Technology Management in a Rapidly Changing Market ». In IEMC’01 Proceedings.
Change Management and the New Industrial Revolution. IEMC-2001 (Cat. No.01CH37286),
37-43. Albany, NY, USA: IEEE. https://doi.org/10.1109/IEMC.2001.960477.","Henkel, Joachim, et Stephan Jung. 2010. « Identifying Technology Applications Using an
Adaptation of the Lead User Method ». SSRN Electronic Journal.
https://doi.org/10.2139/ssrn.1399394.","Lee, Sungjoo, Byungun Yoon, et Yongtae Park. 2009. « An Approach to Discovering New
Technology Opportunities: Keyword-Based Patent Map Approach ». Technovation 29
(6-7): 481-97. https://doi.org/10.1016/j.technovation.2008.10.006.","Loch, Christoph H., Christian Terwiesch, et Stefan Thomke. 2001. « Parallel and Sequential
Testing of Design Alternatives ». Management Science 47 (5): 663-78.
https://doi.org/10.1287/mnsc.47.5.663.10480","Sommer, Svenja C., et Christoph H. Loch. 2004. « Selectionism and Learning in Projects with
Complexity and Unforeseeable Uncertainty ». Management Science 50 (10): 1334-47.
https://doi.org/10.1287/mnsc.1040.0274.","Souder, William E. 1989. « Improving Productivity Through Technology Push ». Research-
Technology Management 32 (2): 19-24.
https://doi.org/10.1080/08956308.1989.11670582.","Thomke, Stefan, Eric von Hippel, et Roland Franke. 1998. « Modes of Experimentation: An
Innovation Process—and Competitive—Variable ». Research Policy 27 (3): 315-32.
https://doi.org/10.1016/S0048-7333(98)00041-9.","Wall, Marina, Jürgen Gausemeier, et Christoph Peitz. 2013. « Technology Push-Based Product
Planning - Future Markets for Emerging Technologies ». International Journal of
Technology Marketing 8 (1): 61. https://doi.org/10.1504/IJTMKT.2013.051965",,,,,,,,,,,,,,,,,,,,,,,,,,,,,,,,,,,,,,,,,,,,,,,,,,,,,,,,,,,,,,,,,,,,,,,,,,,,,,,,,,,,,,,,,
"PATRICIO, RUI ","MOREIRA, ANTONIO","ZURLO, FRANCESCO",,,,,IMPROVING THE INNOVATION PROCESS THROUGH GAMIFICATION: AN EXPLORATORY CASE STUDY,01. Creativity in New Product Development,"Previous studies have shown that integrating gamification in innovation is a
promising research avenue. Moreover, a need to study and further validate the
actual value of gamification in relation to innovation, considering, in particular, its
mechanics and participants’ motivation, has been identified in the literature
(Brandt, Messeter, & Binder, 2008; Kavaliova, Virjee, Maehle, Kleppe, & Nisar,
2016). Therefore, the purpose of this paper is to examine how gamification
approaches, i.e. the use of game elements in non-gaming contexts, can improve
the innovation process, particularly the idea development phase of the early
stage of innovation. Gamification is proposed in this paper to overcome the
difficulties of managing the innovation process such as volatility, informality, goal
setting, coordination, alignment, motivation and knowledge building (Birkinshaw
& Mol, 2006; Ollila & Yström, 2016; Ulrich & Eppinger, 2012; Vaccaro, Jansen,
Van Den Bosch, & Volberda, 2012; Zimmerling, Hoflinger, Sandner, & Welpe,
2016).
Brief literature mapping and key references
The early stage of the innovation starts with ideation that includes insights
discovery, idea generation, idea selection and development, and ends with the
decision, positive or negative, to develop a new product/service (Kurkkio,
Frishammar, & Lichtenthaler, 2011; Riel, Neumann, & Tichkiewitch, 2013;
Wowak, Craighead, Ketchen, & Hult, 2016).
Gamification, i.e. the process of making activities more game-like, in non-game
contexts, to encourage users’ motivation and engagement in a particular task
(Deterding, Dixon, Khaled, & Nacke, 2011), e.g. to improve employee
engagement or outside it, e.g. to co-develop products with customers
(Piligrimiene, Dovaliene, & Virvilaite, 2015; Robson, Plangger, Kietzmann,
McCarthy, & Pitt, 2015).
Approach/Method
The paper follows a qualitative research perspective, influenced by Yin’s (2009)
contribution to the theory. Conducting a case study research in a real business
setting is appropriate as it facilitates a more comprehensive understanding of
such an emergent phenomenon (Goffin, Ahlström, Bianchi, & Richtner, 2018;
Kindström, Kowalkowski, & Sandberg, 2013; Ponelis, 2015; Yin, 2009).
Theoretical development/research model/research questions
The paper argues that gamification approaches can support and improve the idea
development phase of the innovation process, by generating multiple positive
outcomes. Two research questions were investigated in the context of a firm that
used gamification approaches to idea development: firstly, what are the main
outcomes of gamification approaches to innovation process? and secondly, how
should gamification be deployed across the innovation process to generate
positive outcomes? These research questions were the starting point in the
investigation process, which allowed articulating the whole research design and
provided rich insight into the specific context of gamification approaches to
innovation process (Creswell, 2007).
Data/Findings
The results show that the proposed gamification approach substantially improves
aspects of employee’s engagement, team spirit, and consensus building as well
as the management of idea development in a more structured and timely
manner. Findings also suggest that the main drivers of a successful gamification
deployment in the idea development phase are workshop iteration and
facilitation.
Conclusion and contribution to the field
The originality of this paper is the use of gamification approaches to support and
manage the idea development phase of the innovation process. This topic was
extended from the existing literature that discusses the relationship between
innovation and gamification, providing potential implications for both theory and
practice with evidence of gamification approaches to innovation in a real business
setting.
Managerial implications
Besides providing implications for theory in the area of the innovation process,
results are particularly important to innovation, R&D, and new product/service
development managers interested in using gamification to support and improve
the early stage of the innovation process.","Birkinshaw, J. M., & Mol, M. J. (2006). How management innovation happens. MIT Sloan
Management Review, 47(4), 81–88. https://doi.org/Article",,,,,,,,,,,,,,,,,,,,,,,,,,,,,,,,,,,,,,,,,,,,,,,,,,,,,,,,,,,,,,,,,,,,,,,,,,,,,,,,,,,,,,,,,,,,,,,,,,,,,,
