"KAWAKAMI, TOMOKO ","SEICHI, FUJII","NAKAMURA, TOMOYA",,,,,"ORGANIZATIONAL CULTURE, STRUCTURE AND PROCESS AS THE ANTECEDENTS OF SERIAL INNOVATORS",16 - Organising New Product Development,"This research explores the antecedent factors to enhance the existence level of serial innovators. While the studies on serial innovators were mainly conducted on their individual characteristics and abilities (e.g., Price et al., 2009; Griffin et al., 2012; Griffin et al., 2014), this research focuses on how organizational factors facilitate or hinder the emergence of serial innovators.
Based on the exploratory quantitative and qualitative studies, we develop a conceptual model and test the hypotheses collected from Japanese manufacturing firms in 2018. The results will provide implications for firms on how to change their organizational structure, culture and NPD management to produce more serial innovators for radical innovations.
Brief literature mapping and key references
Serial innovators are defined as those who understand customers’ needs, champion the development processes, implement all the necessary activities with the help of other members, and in turn, contribute to the company’s performance in innovations (Griffin, Price, and Vojak, 2012). Studies on serial innovators have been accumulated in the decade, but empirical evidence on organizational factors are still limited (Griffin, Price, and Vojak, 2012).
Furthermore, the findings are mainly from the individualistic cultures. For example, Corradini, Battisti and Demirely (2016) have analyzed serial innovators in small vs. large companies in the U.K. and found that serial innovators in small companies benefit more from high-quality patents in the specialized fields than those who in large companies. To date, however, few studies are conducted on Asian companies.
Based on this understanding of the gap in the extant literature, this research collects data from Asia, more specifically Japan which is known for its highly collectivistic culture.
Approach and Methodology
First, we conducted an exploratory quantitative survey to find where serial innovators exist in Japan from January to February 2016. The survey respondents were 284 with the 17.8% response rate. From this exploratory survey, we found that the average number of serial innovators in Japan is around 4 out of 100 engineers.
Then we started to contact with these serial innovators who responded to the survey and met them one person to another. The interviewees were from various industries including both BtoB and BtoC companies, covering such industries as pharmaceutical, beverage, apparel, cosmetic, metal, chemical, semiconductor among others. The total length of the interview was 1,643 hours.
After transcribing all the recorded interviews, three researchers in this project analyzed the interview note independently in order to hypothesize the relationships between the constructs mentioned in the interviewees’ words. After the discussions, we agreed on the key constructs and their priorities to develop a conceptual model for empirical test.
Conceptual Model
Our hypothesized conceptual model is shown in Figure 1. In this model, we conceptualized that three organizational factors affect emergence of serial innovators, and in turn, innovation performance. The antecedent organizational factors are 1) organization culture, 2) NPD process and 3) organizational structure.
In the 1) organization structure aspect, two factors are included; risk taking and organizational innovativeness. In the 2) NPD process aspect, fluidity of NPD stages and open innovation orientation are included. Finally, in the 3) organizational structure aspect, marketing-R&D integration factor will be investigated. All these factors are found based on the existing literature and our interview data.
Figure 1. Conceptual model of the Factors affecting Emergence of Serial Innovators
Contributions and Implications
This research contributes to the literature by providing new conceptual framework on how organizational factors interact with the emergence of serial innovators based on the evidence from collectivistic culture, Japan. This could be beneficial to generalize the findings in this area to be more applicable to different cultures. This research also contributes to practice with additional insights for senior managers and policy makers on how to encourage radical innovation.","Griffin, A., Price, R., Vojak, B. and Hoffman, N. (2014) “Serial innovators’ processes: How they overcome barriers to creating radical innovations,” Industrial Marketing Management, 43(8): 1362-1371.","Adner, R. (2006). Match your innovation strategy to your innovation ecosystem. Harvard Business Review, 84(4), 98-+.","Adner, R., & Kapoor, R. (2010). VALUE CREATION IN INNOVATION ECOSYSTEMS: HOW THE STRUCTURE OF TECHNOLOGICAL INTERDEPENDENCE AFFECTS FIRM PERFORMANCE IN NEW TECHNOLOGY GENERATIONS. Strategic Management Journal, 31(3), 306-333. doi: 10.1002/smj.821","Ahuja, G. (2000). Collaboration networks, structural holes, and innovation: A longitudinal study. Administrative Science Quarterly, 45(3), 425-455. doi: Doi 10.2307/2667105","Aoki, K., & Wilhelm, M. (2017). The Role of Ambidexterity in Managing Buyer-Supplier Relationships: The Toyota Case. Organization Science, 28(6), 1080-1097. doi: 10.1287/orsc.2017.1156","Cusumano, M.A. (2010). Staying Power: Six Enduring Principles for Managing Strategy and Innovation in an Uncertain World. USA: Oxford University press.",DRUPA. (2017). 4th drupa Global Trends report 2017 Executive Summary drupa Global Trend (pp. 9): Messe Düsseldorf.,"Dyer, J. H. (1996). Specialized supplier networks as a source of competitive advantage: Evidence from the auto industry. Strategic Management Journal, 17(4), 271-291. doi: 10.1002/(sici)1097-0266(199604)17:4<271::aid-smj807>3.0.co;2-y","Dyer, J. H., & Hatch, N. W. (2006). Relation-specific capabilities and barriers to knowledge transfers: Creating advantage through network relationships. Strategic Management Journal, 27(8), 701-719. doi: 10.1002/smj.543","Ehrenhard, M., Kijl, B., & Nieuwenhuis, L. (2014). Market adoption barriers of multi-stakeholder technology: Smart homes for the aging population. Technological Forecasting and Social Change, 89, 306-315. doi: 10.1016/j.techfore.2014.08.002","Gulati, R. (1998). Alliances and networks. Strategic Management Journal, 19(4), 293-317. doi: 10.1002/(sici)1097-0266(199804)19:4<293::aid-smj982>3.0.co;2-m","Gulati, R., Nohria, N., & Zaheer, A. (2000). Strategic networks. Strategic Management Journal, 21(3), 203-215. doi: 10.1002/(sici)1097-0266(200003)21:3<203::aid-smj102>3.0.co;2-k","Hendrikse, G. W. J., & Feng, Li. (2013). Interfirm cooperatives. In A. Grandori (Ed.), Handbook of Economic Organization: Integrating Economic and Organization Theory (pp. 501-521): Edward Elgard","Hendrikse, G. W. J., & Veerman, C. P. (2001). Marketing cooperatives and financial structure: a transaction costs economics analysis. Agricultural Economics, 26(3), 205-216. doi: 10.1111/j.1574-0862.2001.tb00064.x","Iansiti, M., & Levien, R. (2004). Strategy as ecology. Harvard Business Review, 82(3), 68-+.","Li, Y. R. (2009). The technological roadmap of Cisco's business ecosystem. Technovation, 29(5), 379-386. doi: 10.1016/j.technovation.2009.01.007","Moller, K. K., & Halinen, A. (1999). Business relationships and networks: Managerial challenge of network era. Industrial Marketing Management, 28(5), 413-427. doi: 10.1016/s0019-8501(99)00086-3","Moore, J. F. (1993). PREDATORS AND PREY - A NEW ECOLOGY OF COMPETITION. Harvard Business Review, 71(3), 75-86.","Nieuwenhuis, L. J. M., Ehrenhard, M. L., & Prause, L. (2018). The shift to Cloud Computing: The impact of disruptive technology on the enterprise software business ecosystem. Technological Forecasting and Social Change, 129, 308-313. doi: 10.1016/j.techfore.2017.09.037","Powell, W., & Grodal, S. . (2005). Networks of Innovators The Oxford Handbook of Innovation (pp. 56-85): Oxford University Press.","Thomas, L. D. W., Autio, E., & Gann, D. M. (2014). ARCHITECTURAL LEVERAGE: PUTTING PLATFORMS IN CONTEXT. Academy of Management Perspectives, 28(2), 198-219. doi: 10.5465/amp.2011.0105","Tushman, M. L. (2004). From engineering management/R&D management, to the management of innovation, to exploiting and exploring over value nets: 50 years of research initiated by the IEEE-TEM. Ieee Transactions on Engineering Management, 51(4), 409-411. doi: 10.1109/tem.2004.836365","Yin, Robert K. (2014). Case Study Research, Design and Methods: Sage publications",,,,,,,,,,,,,,,,,,,,,,,,,,,,,,,,,,,,,,,,,,,,,,,,,,,,,,,,,,,,,,,,,,,,,,,,,,,,,,,,
"KAWAKAMI, TOMOKO ","NAKAMURA, TOMOYA","SEICHI, FUJII",,,,,SERIAL INNOVATORS AND THEIR INTRAPERSONAL DIVERSITY FOR RADICAL INNOVATIONS,17 - Radical Innovation,"This research focuses on the construct of intrapersonal diversity for better understanding of serial innovators. The extant research on the attributes of serial innovators covers such aspects as technical creativity, marketing creativity, political skills and project management skills (e.g., Sim et al., 2007; Griffin, Price and Vojak, 2012). However, these skills and capabilities are mostly regarded as innate.
In contrast, this study proposes to focus more on intrapersonal diversity which can be accumulated through various experiences before and during the innovation processes. We also hypothesize that intrapersonal diversity has a positive effect on individual performance (Albert, 2008).
Since no study has been done to explain the relationship between intrapersonal diversity and the emergence of serial innovators, this research will shed a new light to enrich this research area. Furthermore, an evidence from Japanese firms with collectivistic culture will deepen the understanding on how to manage serial innovators in the international NPD contexts.
Brief literature mapping and key references
Since its introduction of the concept of serial innovators, both conceptual and empirical studies have been accumulated in the past decade. Serial innovators are defined as those who can continuously lead innovations even in a mature large firm (Griffin, Price and Vojak, 2012; Griffin et al., 2014).
In particular, serial innovators can create break through innovations rather than incremental ones. They can solve critical issues for people, organizations and society more than once in their company life.
In the past studies, skills and capabilities required for serial innovators were regarded as innate and therefore, hiring such people was discussed as a critical issue for utilizing the power of serial innovators.
On the other hand, intrapersonal diversity which means accumulated various experiences has been discussed as one of the essential factors for innovators (Albert, 2008). intrapersonal diversity has been found to have a positive effect on individual performance, however, no study has investigated its effect on the emergence of serial innovators.
Approach and Methodology
This research consists of both quantitative and qualitative approach. In January and February 2016, a quantitative survey was sent to Japanese manufacturers to find serial innovators. Then from August to December 2016, 39 semi-structured interviews were conduced at 21 companies. The industries of the respondents were diverse including pharmaceutical, beverage,
apparel, cosmetics, metal, etc. The total length of the interviews reached 1642 hours.
The transcription of the interviews was independently analyzed by three researchers of this project. During the process, we found this key construct, intrapersonal diversity, which had not been studied in the literature.
Contributions and Implications
Based on the interviews with serial innovators and their colleagues around them in Japan, we have found that intrapersonal diversity is one of the key factors. In other words, if the individuals are highly diverse from what they had accumulated through their past experiences, the more likely the person can be a serial innovator.
This study can contribute to the academics in twofold. First, proposing a new factor, intrapersonal diversity, will enrich the concept and framework of serial innovators. Second, this research adds new evidence from a collectivistic country and will help generalize the theory to be more applicable to other cultures.
Practically, this research suggests that, not only hiring a talented person as a serial innovator but also providing environment such as in-house trainings and job rotations for exposing individuals to other experiences can enhance the emergence level of serial innovators more systematically.","Cannella Jr., Albert. A. (2008), “Top management Team Functional Background Diversity and Firm Performance: Examining the Role of Team member Colocation and Environmental Uncertainty,” Academy of Management Journal,51(4); 768–784.","Eisenhardt, K.M. (1989). Building Theories from Case Study Research. Academy of
Management Review, 14(4), 532-550.","Herzog, P. and Leker, J. (2010). Open and closed innovation – different innovation
cultures for different strategies. International Journal of Technology Management,
52(3/4), 322–343","West, J. and Bogers, M. (2014). Leveraging external sources of innovation: a review
of research on open innovation. Journal of Product Innovation Management, 31(4),
814-831.","Yin, R. K. (2003). Case study research: Design and methods (3rd ed.). Thousand
Oaks, CA: Sage",,,,,,,,,,,,,,,,,,,,,,,,,,,,,,,,,,,,,,,,,,,,,,,,,,,,,,,,,,,,,,,,,,,,,,,,,,,,,,,,,,,,,,,,,,,,,,,,,,
"KHRAISHI, AHMAD ","PAULRAJ, ANTONY","HUQ, FAHIAN",,,,,OFFSHORE OUTSOURCING INNOVATION IN SMES: THE ART OF COLLABORATION WITH STRANGERS,12 - Networks and Alliances in New Product Development,"Despite extensive research and general scholarly agreement that complementary capabilities of the dyad is essential to successful outsourcing innovation collaborations, the role of complementary capabilities of the dyad remains underexplored in the case of offshore outsourcing innovation (OOI) in SMEs (Gusenbauer et al., 2015, Musteen and Ahsan, 2013). Our interest is in tracing complementary capabilities of the dyad's role in these exchanges.
When applied in the context of OOI in SMEs, complementary capabilities of the dyad can act as a shift parameter towards adopting OOI given that SMEs have no room internally for highly expensive investments in innovation (De Vita et al., 2010, Spithoven and Teirlinck, 2015). Typically however, SMEs find their greatest shortcomings in combining internal and external knowledge and expertise and in building and coordinating long term interfirm relationships (van de Vrande et al., 2009).
In SMEs, OOI is conssistent with the relational view (Dyer and Singh, 1998); which sees SMEs engage OOI strategies to substitute for in-house deficiencies in innovation resources and capabilities. Also, abiding the rationale of the extended resource based view, SMEs manage to gain competitive advantage through leveraging their relational capability to establish and coordinate OOI relationships despite their lack of ownership and control over their offshore suppliers valuable innovation resources (Lavie, 2006).This is in contrast with large firms which prefer to internalise all innovation resources , or utilise OOI to complement their internal innovation activities (Lewin et al., 2009, Stanko and Calantone, 2011). Therefore, constrained with their limited resources, SMEs are usually a weak representation of the focal firm in dyadic or network alliances (Albors-Garrigos et al., 2011, Julien, 1993). SMEs often have access to a smaller pool of small or less specialised suppliers to choose form than in the case large firms (Koufteros et al., 2012, Mindruta et al., 2016). Moreover, they have limited capacity in terms of the number of OOI relationships they can afford to
2
Offshore Outsourcing Innovation in SMEs
establish and continue (Mitsuhashi and Greve, 2009). Thus, notwithstanding their limited choices and chances in finding the right offshore supplier and location for their OOI endeavour, little is known about how SMEs learn to master the art of collaboration with strangers in OOI relationships (Gusenbauer, Massini and Fink, 2015, Mitsuhashi and Greve, 2009).
In this study we aim to delineate why supplier’s asset specificity and goal compatibility predict complimentary capabilities of the dyad, and how complementary capabilities of the dyad might affect performance of OOI in SMEs. To test our proposed model we collected date from 200 developed country European SME manufacturers.
Our study intend to contribute to SMEs and outsourcing innovation theories by conceptualising and examining OOI in SMEs from the theoretical perspective of the relational view (Dyer and Singh, 1998) and the extended resource based view (Lavie, 2006). Our empirical model provides concepts linking OOI performance in SMEs to antecedents and impacts of dyadic complementarity. We argue that SMEs’ OOI relationships that are characterised with high goal compatibility and in which the offshore supplier contributes specific assets can achieve complementary relational rent. We also show how this dyadic complementarity mediates the impact of those factors in influencing the overall OOI performance. Therefore, we empirically contribute to the OOI management literature in SMEs. Finally, we add to our understanding about how SMEs and large firms are different","Albors-Garrigos, J., Etxebarria, N.Z., Hervas-Oliver, J.L. and Epelde, J.G. (2011). Outsourced innovation in SMES: a field study of R&D units in Spain. International Journal of Technology Management 55(1-2), 138-155.","Katz, J. S. (2006). Indicators for complex innovation systems. Research Policy, 35(7), 893-909.","Juntunen, J. K., Halme, M., Korsunova, A., Rajala, R. (2018). Strategies for integrating stakeholders into sustainability innovation: A configurational perspective. Journal of Product Innovation Management, doi: 10.1111/jpim.12481 (in press).","Dougherty, D., Dunne, D. D. (2011). Organizing ecologies of complex innovation. Organization Science, 22(5), 1214-1223.","Talke, K., Salomo, S., Kock, A. (2011). Top management team diversity and strategic innovation orientation: The relationship and consequences for innovativeness and performance. Journal of Product Innovation Management, 28(6), 819-832.","Garcia‐Castro, R., Francoeur, C. (2016). When more is not better: Complementarities, costs and contingencies in stakeholder management. Strategic Management Journal, 37(2), 406-424.","Watson, R., Wilson, H. N., Smart, P., Macdonald, E. K. (2018). Harnessing Difference: A Capability‐Based Framework for Stakeholder Engagement in Environmental Innovation. Journal of Product Innovation Management, 35(2), 254-279.","Gopalakrishnan, S., Damanpour, F. (1994). Patterns of generation and adoption of innovation in organizations: Contingency models of innovation attributes. Journal of Engineering and Technology Management, 11(2), 95-116.","Torugsa, N., Arundel, A. (2016). Complexity of Innovation in the public sector: A workgroup-level analysis of related factors and outcomes. Public Management Review, 18(3), 392-416.",,,,,,,,,,,,,,,,,,,,,,,,,,,,,,,,,,,,,,,,,,,,,,,,,,,,,,,,,,,,,,,,,,,,,,,,,,,,,,,,,,,,,,,,,,,,,,
"KLEIN, SASCHA ","SCHNEIDER, SABRINA","SPIETH, PATRICK",,,,,SOCIAL BUSINESS MODELS: RIGID AND FLEXIBLE CONSEQUENCES OF STRATEGIC CHOICES,"19 - Social, Frugal and BoP Innovation","Social businesses have the mission to solve social issues by creating social value, while striving for commercial activities to fund themselves. Besides increasing practical occurrence and relevance, these organizations provide an interesting avenue for research on innovative hybrid organizations regarding the consequences of combining different institutional logics (Battilana and Lee 2014). To date, a number of studies on hybrids propose several typologies of social businesses and investigate the tensions caused by institutional plurality. Despite possible tensions, the combination of institutional logics can also act as an enabler of innovation and new organizational mechanisms (Jay 2013). Although recent research identifies value drivers of social business models (BMs) (Spieth et al. 2018), the extent to which concrete consequences of strategic choices in social businesses interact and reinforce each other, remains poorly understood and lacks empirical proof.
Therefore, this study seeks to explore strategic choices and aims to identify (rigid and flexible) consequences due to pluralistic institutional logics. By applying the choices and consequences logic of BMs proposed by Casadesus-Masanell and Ricart (2010) we conduct a qualitative research design with a multiple case study comprising a purposeful sampling strategy.
We account for information-rich cases by identifying firms with clearly articulated social missions (e.g. by scanning website, annual reports) in order to derive patterns for fundamental choices and consequences of hybrids. The sample comprises more than 20 social businesses, with ongoing data collection in the next few weeks until we reach theoretical saturation. Preliminary data analysis reveals emerging patterns of choices and consequences that are influenced by the underlying values. However, cross-case analysis shows different implications for rigidity (e.g. the choice to collaborate only with partners that share the same values) and flexibility of the consequences depending on the priority level of social value generation. Furthermore, we identified path dependencies and feedback loops due to the priority assigned either to commercial or social value logic. Thus, new opportunities for further value creation (commercial as well as social) and BM innovation may result from these peculiarities. Interestingly, the
data reveals that hybrids that generate social value automatically by selling their product or service to customers that are also the beneficiaries of the social value show different feedback loops than those firms that differentiate between customers and beneficiaries.
With the identification of feedback loops and path dependencies as well as rigid and flexible consequences, we respond to several calls for investigating configurations of hybrids (Battilana, Lee 2014) that combine different institutional value logics for value capturing (Laasch, 2017) and extend previous research on flexibility of hybrids (Smith and Besharov 2017) and value drivers of social BMs (Spieth et al. 2018). A better understanding of the choices and consequences in hybrids also helps managers of both – social businesses as well as commercial businesses: First, managers in social enterprises can learn how to align social value generation with commercial activities efficiently. Second, it helps managers of commercial firms to realize the consequences of their decisions, when a commercial firm aims to generate social value.","Battilana, Julie; Lee, Matthew (2014): Advancing Research on Hybrid Organizing – Insights from the Study of Social Enterprises. In The Academy of Management Annals 8 (1), pp. 397–441. DOI: 10.1080/19416520.2014.893615.","Fischer, A. (2011). Recognizing opportunities: initiating service innovation in PSFs.
Journal of Knowledge Management, 15(6), 915-927","Lemus Aguilar, I., & Nuchera, Hidalgo (2015). Innovation in consulting firms: what are
the foundations?","Mandel, C.A., 2009. Innovation in Consulting. A quantitative Approach. , pp.12–14.
O'Cass, A., Song, M., & Yuan, L. (2013). Anatomy of service innovation: Introduction
to the special issue, Journal of Business Research, pp. 060-1062.","Tether, B. S., & Tajar, A. (2008). Beyond industry–university links: Sourcing
knowledge for innovation from consultants, private research organisations and the
public science-base. Research Policy, 37(6-7), 1079-1095","Trigo, A., & Vence, X. (2012). Scope and patterns of innovation cooperation in Spanish
service enterprises. Research Policy, 41(3), 602-613","Wright, C., Sturdy, A., & Wylie, N. (2012). Management innovation through
standardization: Consultants as standardizers of organizational practice. Research
Policy, 41(3), 652-662",,,,,,,,,,,,,,,,,,,,,,,,,,,,,,,,,,,,,,,,,,,,,,,,,,,,,,,,,,,,,,,,,,,,,,,,,,,,,,,,,,,,,,,,,,,,,,,,
