AUTHOR 1,AUTHOR 2,AUTHOR 3,AUTHOR 4,AUTHOR 5,AUTHOR 6,AUTHOR 7,,,ABSTRACT,REFERENCES (ONE REFERENCE PER COLUMN),,,,,,,,,,,,,,,,,,,,,,,,,,,,,,,,,,,,,,,,,,,,,,,,,,,,,,,,,,,,,,,,,,,,,,,,,,,,,,,,,,,,,,,,,,,,,,,,,,,,,,
"ACUR, NURAN ","PADMANABHAN, SANDOSH","VON DELFT, STEPHAN","KARMACHARYA, BIRAJ MAN","SHRESTHA, PRAMITA","RAJ SHAKYA, PRABIN",,SOCIAL BUSINESS MODEL EVOLUTION IN AND AROUND SOCIAL CAPITAL DEVELOPMENT: A CASE STUDY FROM NEPAL,"19 - Social, Frugal and BoP Innovation","Microfinance related health business models are suggested to be an opportunity that transcends geographical constraints within countries, representing a supportive social networking resource (i.e., social capital) to improve health disparities in the least developed nations (Gertler et al., 2019). This assertion, however, remains understudied. Little is known as to how to evolve business models according to societal changing needs where the social capital is mostly weak.
Research in the area has focused on new ideas and on how these improve the life of the poor by offering employment and business opportunities (Simanis and Hart, 2008). However, the emphasis has been on external factors that influence new social business model innovation. The social business model like microfinance programme can be described as a system of interconnected and interdependent health related activities that determines the way the communities functions in concert with its stakeholders (i.e. women, families, career, policy makers, health workers and so on). In other words, a business model is a bundle of specific activities – an activity system – conducted to satisfy the perceived needs of the community. It specifies which parties within or as social partners supporting the community (women) conduct which activities, and how these activities are linked to each other (Amit and Zott, 2012, Zott and Amit, 2010).
The successful microfinance business model which manage to create social and economic value over extended periods of time successfully shape, adopt and renew their business model to fuel such value creation. This paper aims to investigate how social capital development of community-enabled business model to evolve in order to achieve social value creation to the society (see Figure 1). As such, we aim to enrich the discussion on the need to nurture relationships at the Bottom of the pyramid- BOP and develop social capital in BOP communities beyond the emphasis on traditional economic remedies for poverty alleviation by introducing a new business model (e.g. Ansari et al., 2012). We used three dimensions of social capital to develop our framework (Nahapiet and Ghoshal, 1998):
1. the structural dimension (configurations and patterns of connections between people such as such as network density, connectivity, hierarchy and so on),
2. the relational dimension (beliefs and norms that bond people together in a social network such as respect, friendship, trust, trustworthiness, expectations, norms, obligations)
3. the cognitive dimension (shared representation, interpretation and systems of meaning among people in the same social network, such as shared narratives, shared language and shared codes).
We adopt a longitudinal case as our research method. Drawing on findings from a microfinance programme on continuously improving health-related activities performed by Dhulikhel Hospital in Nepal over the period of 10 years, this research will be the first study to take the evolution of social business models over time into consideration. Dhulikhel Hospital’s Microfinance Program (MFP) introduced in 2008 as part of their community development programme, is considered a social business model innovation in the management literature. The Dhulikhel programme provides integrated microfinance with health components (such as microcredit and health education) to women in a novel way to enhance health as well as build livelihoods. We conducted 15 interviews with the people who developed and run the microfinance programme in Dhulikhel Hospital as well as the participants of the programme within two health centres (Figure 2).
We used several methods to analyse the data, which enabled us to examine data from several perspectives to explore interesting features and to cross-validate common findings. Firstly, the first author constructed a case narrative, including verbatim quotations from interviewees, to provide a rich description of the Business Model Innovation in relations to social capital development. In a similar approach to Jarzabkowski and Balogun (2009) this narrative was then read, discussed and refined by the other two researchers acting as ‘outsiders’ in questioning the narrative themes and timeline. Secondly, we constructed a time-ordered event listing (Miles and Huberman, 1994) to capture the temporal flow of the sequence of events, allowing us to identify the emergence and concurrency of different forms knowledge during the evaluation how the model works. Our in-depth case involved considerable iteration between data collection and analysis as we sought to ensure information was verified and meaningfully interpreted.
Findings:
The social business model evolved from microfinance with health education for disadvantaged women to integrating microfinance with other health components (i.e., health micro-insurance, linkage to health providers) to all family members of the participating women (se Figure 1).
Figure 1.
The business model aims seemed to be shifted away from how to give health education to women in order to solve their health problems to how programme can be part of the solution to these problems in the community via giving the participants the opportunity to ‘co-create’ new ideas/ services rather than remain passive microfinance participant.
We found that three social capital elements were essential to enabling social business model evolution. Please see Table 1.","Amit, R. and Zott, C. (2012). ‘Creating Value Through Business Model Innovation’, MIT","Ernst, Holger, Hoyer, Wayne D., Krafft, Manfred and Krieger, Katrin (2011). Customer","Joshi, Ashwin W. and Sharma, Sanjay (2004). Customer knowledge development:","Gordon, Geoffrey L., Schoenbachler, Denise D., Kaminski, Peter F., Brouchous,","Griffin, Abbie and Hauser, John R. (1993). The voice of the customer. Marketing","Kuester, Sabine, Homburg, Christian and Hildesheim, Andreas (2017). The catbird seat","Kuester, Sabine and Rauch, Andreas (2016). A job demands-resources perspective on","Malshe, Avinash and Biemans, Wim (2014). The Role of Sales in NPD: An Investigation
of the US Health-Care Industry. Journal of Product Innovation Management, 31(4),
664-679.","Ringle, Christian M., Wende, Sven and Becker, Jan-Michael. (2015). SmartPLS 3.
Bönningstedt: SmartPLS. Retrieved from http://www.smartpls.com.","Rochford, Linda and Wotruba, Thomas R. (1993). New product development under",,,,,,,,,,,,,,,,,,,,,,,,,,,,,,,,,,,,,,,,,,,,,,,,,,,,,,,,,,,,,,,,,,,,,,,,,,,,,,,,,,,,,,,,,,,,,
"ADAMS, KAI-UWE","KOLLER, HANS",,,,,,OPEN INNOVATION: POTENTIAL OF ONLINE COMMUNITIES TO GENERATE PRODUCT INNOVATIONS – THE EXAMPLE OF SONY ALPHA CAMERAS,15 - Open Innovation,"The producer model is understood as the manufacturer's task of creating the key designs for innovation and selling them to the consumer through goods and services (Baldwin, Hippel, 2011). On the other hand, the Open and User Innovation (OUI) Research claims that the active involvement of users knowledge is a valuable resource for innovations which leads to products and services that meet users requirements better (Chesbrough, 2003; Prahalad, Ramaswamy, 2004; Sawhney, Verona, Prandelli, 2005; Vandenbosch/Dawar 2002). This work aims at extending this OUI paradigm by another example showing that users from photography elaborated almost all shortcomings in the previous versions of the second Sony Alpha camera generation in different online communities. Interestingly, it can be shown that Sony improved almost every shortcoming mentioned by the users with the next version of the camera.
Brief literature mapping and key references Research about open and user innovation (OUI) has shown that experienced and skilled users are united in online-communities and can contribute to product development (e.g., Füller et al., 2004; Füller et al., 2007; Janzik, Raasch, 2011). Online-Communities are individually structured (Stanoevska-Slabeva, 2002), they own the potential to influence the design- and communication costs positively (Baldwin, Hippel, 2011). The passive usage of online-communities by the producer allows a strong appropriation strategy without the risk of breaking the flow of information (Laursen, Salter, 2013).
Research questions This study intends to substantiate the potential of generating product innovations through the integration of user knowledge from online communities for another interesting example.
Method and Data This study follows a netnographic approach (Kozinets, 2002, 2006). Three selected online-communities are used to extract 7460 contributions by the community-members. Those contributions created a list of 40 improvement proposals, generated out of the discussions by the community members. These free-of-charge informations are available with no assistance of community members or operators needed.
Findings Online-communities offer a cost-effective and high-quality user involvement. The generated list of improvement proposals was significantly matched by the real world product improvement brought through the next product generation by the producer of the focal product. Second, community members appreciate that the information they contribute is captured and implemented. They see that the producer values their involvement which can have a positive impact on the image of the producer. As third potential, online communities can reduce communication costs of the producer, especially for producer innovation.
Members of online-communities take over explanations in the form of text contributions as well as extensive video tutorials.
Contribution to the field and managerial implications This study contributes to the literature about the usage of information that users from online-communities release freely to the producer and to other innovators. Against this backdrop companies need to integrate user communities into their innovation processes. Perhaps they even should foster and support this release of ideas. Second, managers should find a way to improve intraorganizational structures to match the gained user knowledge with the internal experts developing the next product or service (Foss, 2011). Third, to reduce the risk of an information overload or a delay a continuous analysis of online communities is better suited than the retrospective form of investigation used in this work. Fourth, communities can also be used to help with customer communication.","Baldwin, C., & Von Hippel, E. (2011). Modeling a paradigm shift: From producer innovation to user and open collaborative innovation. Organization Science, 22(6), 1399-1417.","Candi, M. and Beltagui, A., 2018. Effective use of 3D printing in the innovation process. Technovation, in press.","d’Aveni, R., 2015. The 3-D printing revolution. Harvard Business Review, 93(5), pp.40-48. ","Despeisse, M., Baumers, M., Brown, P., Charnley, F., Ford, S.J., Garmulewicz, A., Knowles, S., Minshall, T.H.W., Mortara, L., Reed-Tsochas, F.P. and Rowley, J., 2017. Unlocking value for a circular economy through 3D printing: A research agenda. Technological Forecasting and Social Change, 115, pp.75-84. ","Halbinger, M.A., 2018. The role of makerspaces in supporting consumer innovation and diffusion: An empirical analysis. Research Policy, 47(10), 2028-2036. ","Hargadon, A. and Sutton, R.I., 1997. Technology brokering and innovation in a product development firm. Administrative science quarterly, pp.716-749. ","Khajavi, S.H., Partanen, J. and Holmström, J., 2014. Additive manufacturing in the spare parts supply chain. Computers in industry, 65(1), pp.50-63. ","Mortara, L. and Parisot, N., 2018. How do fab-spaces enable entrepreneurship? Case studies of'makers'–entrepreneurs. International Journal of Manufacturing Technology and Management, 32(1), pp.16-42. ","Raasch, C., Herstatt, C. and Balka, K., 2009. On the open design of tangible goods. R&D Management, 39(4), pp.382-393. ","Rayna, T., Striukova, L. and Darlington, J., 2015. Co-creation and user innovation: The role of online 3D printing platforms. Journal of Engineering and Technology Management, 37, pp.90-102. ","Sarasvathy, S.D., 2001. Causation and effectuation: Toward a theoretical shift from economic inevitability to entrepreneurial contingency. Academy of management Review, 26(2), pp.243-263. ","Schniederjans, D.G., 2017. Adoption of 3D-printing technologies in manufacturing: A survey analysis. International Journal of Production Economics, 183, 287-298. ","Weller, C., Kleer, R. and Piller, F.T., 2015. Economic implications of 3D printing: Market structure models in light of additive manufacturing revisited. International Journal of Production Economics, 164, pp.43-56. ","Witell, L., Gebauer, H., Jaakkola, E., Hammedi, W., Patricio, L. and Perks, H., 2017. A bricolage perspective on service innovation. Journal of Business Research, 79, pp.290-298. ",,,,,,,,,,,,,,,,,,,,,,,,,,,,,,,,,,,,,,,,,,,,,,,,,,,,,,,,,,,,,,,,,,,,,,,,,,,,,,,,,,,,,,,,,
"AL HASAN, RIMA","MICHELI, PIETRO",,,,,,CONFIGURATIONS FOR MANAGING THE INTERPLAY BETWEEN PROCESS IMPROVEMENT APPROACHES AND PRODUCT INNOVATION,"04 - Engineering, Production and Supply Issues in Innovation and Product Development","Organizations’ capacity to incrementally and radically innovate their products is crucial for their success, yet this constitutes a fundamental and enduring management challenge (Andriopoulos and Lewis, 2009). Over the past decades, scholars in operations management, strategy and innovation management have proposed divergent conceptual arguments and drawn conflicting empirical conclusions in relation to the interplay between process improvement (PI) approaches and incremental and radical product innovation (Adler et al. 2009; Benner and Tushman, 2015). For some, PI can lead to both degrees of innovation; for others, PI inevitably hinders organizations’ capacity to innovate their products, particularly in a radical way (Benner and Tushman, 2002; Kim et al, 2012).
In-addition to the heterogeneity of the theoretical and empirical arguments that exist in the literature, little is known about the mechanisms that companies can use to manage the interplay between PI and incremental and radical product innovation. Therefore, this research examines how organizations manage the interplay between PI and incremental and radical product innovation.
Method
This research used a qualitative multiple case study approach. Four companies were purposefully sampled. All of the selected companies are large manufacturing companies and based in the United Kingdom. However, they operate in three different industries - automotive, aerospace and pharmaceutical - and vary in their implementation of PI approaches and in the degree of their product innovativeness. Over a 15-month period in 2016-2017, 44 semi-structured interviews with informants from different functional specialisms were conducted, and relevant documents collected. Data were analyzed through an iterative process by using NVivo software.
Findings and contributions
Four different configurations for managing the interplay between PI and product innovation emerged from the data - “strategic and holistic”, “facilitating and empowering”, “operational” and “project-based” - and their associated mechanisms were identified. Overall, PI approaches were considered as enablers for product innovation when used strategically; however, when following a “facilitating and empowering”, an “operational” or
a “project-based” configurations, PI was regarded as an indirect facilitator or as an irrelevant factor in relation to product innovation. Thus, the findings of this research move beyond a single view of PI (Benner and Tushman, 2015) and provide empirical evidence on the paradoxical use of PI to trigger different degrees of product innovation. In the full paper, these configurations and their associate mechanisms for managing the interplay between PI and product innovation will be discussed in more depth.","Adler, P. S., Benner, M., Brunner, D. J., Macduffie, J. P., Osono, E., Staats, B. R., Takeuchi, H., Tushman, M. L. & Winter, S. G. 2009. Perspectives On The Productivity Dilemma. Journal Of Operations Management, 27, 99-113.","Li, Hao, et al. ""A methodology for module portfolio planning within the service solution layer of a product–service system.""The International Journal of Advanced Manufacturing Technology94.9-12 (2018): 3287-3308.",,,,,,,,,,,,,,,,,,,,,,,,,,,,,,,,,,,,,,,,,,,,,,,,,,,,,,,,,,,,,,,,,,,,,,,,,,,,,,,,,,,,,,,,,,,,,,,,,,,,,
"MICHELI, PIETRO",,,,,,,DESIGN THINKING FOR DIGITAL TRANSFORMATION,02. Design Issues and Innovation by Design,"Design thinking is an emerging approach to innovation and problem-solving characterised by
a clear focus on users, the adoption of a systemic perspective, the application of the logic of
‘what may be’ rather than ‘what is’, cross-functional collaboration, iteration and
experimentation (Brown, 2008; Liedtka, 2015; Martin, 2009; Seidel and Fixson, 2013).
Despite increasing interest in industry, empirical research on this topic is still scant,
particularly in relation to its applicability and effectiveness (Micheli et al., 2018).
In this study we focus on large private companies intent in introducing design
thinking practices to support digital transformations aimed at establishing significantly new,
IT-enabled products and services and, eventually, at changing their overall business models
(Sebastian et al., 2017). We conducted this research in two stages: first, we undertook
interviews with 30 key informants working in different organizations, including technology
firms, design consultancies and research institutes to map current practices and identify
suitable sites for our in-depth investigation. Second, we carried out a total of 85 interviews in
nine very large, established companies (between 5 and 15 per site representing a range of
functional groups) operating in different industries: two financial services firms, two airlines,
two medical device manufacturers, a pharmaceutical firm, an appliance manufacturer, and a
software company.
Findings demonstrate the benefits of adopting design thinking practices and of
investing in digital technology in relation to both financial results and customer satisfaction.
Specifically, design thinking practices enabled the sampled organisations enact the shift from
a predominantly technology-push approach to one that starts and ends with the users in mind.
Examples include new ways of interacting with customers in retail banking (from “looking
after your money” to “helping you manage your finances”), airlines (from “flying from a to
b” to “providing travel experiences”) and in the appliance industry (from “selling devices” to
“shaping a better living”). Design thinking practices also enhanced employees’ job
satisfaction, as several firms increasingly connected internal management practices to service
and product delivery. Also, the adoption of digital technologies (e.g., apps, voice controls,
“Internet of Things”) enabled to enhance both users’ and employees’ experiences, as product
and services became more personalised and employees were better able to interact with users
and to suggest improvements. At the same time, this research points to the difficulties in
translating principles into practices and diffusing these across the firm, and to the changes in
structures, spaces and narratives that are necessary to promote and consolidate change
(Nambisan et al., 2017; Yoo et al., 2012).
This research has theoretical and practical implications in two main areas. First, it
shows how design thinking is conceived and implemented in organisations. In particular,
when compared to what written in both academic journals and business reports, the practice
of design thinking in the sampled organizations appears to emphasize certain aspects (e.g.,
user-centredness, cross-functional collaboration, iteration and experimentation) and to
downplay others (e.g., attention to problem framing, adoption of abductive reasoning).
Second, in relation to the introduction and uses of digital technology, this research identifies
three types of approaches - digitization, digital innovation, and digital transformation – each
one with different scope, advantages and drawbacks.","Brown, T. 2008. Design thinking. Harvard Business Review 86 (6): 84–92.","Luo, L., Kannan, P. ., & Ratchford, B. T. (2008). Incorporating Subjective Characteristics in Product Design and Evaluations. Journal of Marketing Research, 45(2), 182–194. https://doi.org/10.1509/jmkr.45.2.182","Schröder, H. H., & Jetter, A. J. M. (2003). Integrating market and technological knowledge in the fuzzy front end: an FCM-based action support system. International Journal of Technology Management, 26(5/6), 517. https://doi.org/10.1504/IJTM.2003.003421","Srinivasan, V., Lovejoy, W. S., & Beach, D. (1997). Integrated Product Design for Marketability and Manufacturing. Journal of Marketing Research, 34(1), 154–163. https://doi.org/10.2307/3152072","Stevens, E. (2014). Fuzzy front-end learning strategies: Exploration of a high-tech company. Technovation, 34(8), 431–440. https://doi.org/10.1016/j.technovation.2013.12.006",,,,,,,,,,,,,,,,,,,,,,,,,,,,,,,,,,,,,,,,,,,,,,,,,,,,,,,,,,,,,,,,,,,,,,,,,,,,,,,,,,,,,,,,,,,,,,,,,,
