"DE WEERD-NEDERHOF, PETRA ","HATAK, ISABELLA ","KUIJPERS, KOEN","CANIELS, MARJOLEIN",,,,INDIVIDUAL RESILIENCE FOR INNOVATION: DOES CONTEXT MATTER?,06 - Innovation Management for Resilience,"It is an understatement to say that individual resilience is important to organizational
outcomes, and not surprisingly scholars have been interested in exploring the issue.
Individual resilience captures the extent to which employees successfully deal with change
and setbacks at work and to which they adapt accordingly to thrive in a new environment
(Näswall et al., 2015). Individual resilience has been related to higher levels of job
performance and organizational commitment (Meneghel et al., 2016; Youssef & Luthans,
2007) and employee creativity (Huang & Luthans, 2015), but the question of how individual
resilience affects innovation behaviour has received little to no attention in the literature.
Theoretically, it is possible that individual resilience hinders or improves innovative
work behaviour, depending on the organizational environment in which the individual is
embedded. In other words, what is functional and dysfunctional in terms of individual
characteristics is largely a matter of context, as reflected in the person-environment fit
literature (Kristof-Brown et al., 2005). To date, however, no studies address organizational
environmental “fit” in terms of enhanced innovative work behaviour for resilient individuals.
This is surprising given the dearth of resilience research standing in contrast to the widely
accepted view that environmental context is a significant predictor of resilience, and that
environmental context can be functional or dysfunctional for innovation outcomes.
Empirically testing the innovation effects of individual resilience in conjunction with the
characteristics of the organizational environment, that is the firm’s innovation orientation and
leadership orientation, is therefore this study’s main aim. A key feature of this research is
thus the contingency perspective we adopt in exploring the role of resilience for innovation –
specifically innovative work behaviour (Janssen, 2000).
We draw upon the person-environment fit literature as applied in innovation research
(e.g. Choi, 2004; Choi & Price, 2005; Ng & Lucianetti, 2016) and currently rely on data from
62 employees of a Dutch company in transition to improving innovation (wave 1; the threewave
longitudinal data-gathering process will be finished in the first half of 2019), using
validated scales to test our direct and moderation hypotheses..
Our preliminary regression analytical findings suggest that individual resilience is
positively related to innovative work behaviour. Importantly, the resilience-induced
improvements in innovative work behaviour are not affected by the organizational
environment.
This paper contributes to the resilience literature by finding support for the positive
resilience-innovative work behaviour relationship. Furthermore, we contribute to scholarship
on innovation management by highlighting the context-free innovation benefits of individual
resilience. In other words, for individual resilience to unfold their behavioural innovation
effects, it seems not to matter whether the organization is focusing on exploratory or
exploitative innovation (Jansen et al., 2006), and neither does it show leadership style (Avilio
& Bass, 2015) affecting the innovation outcomes of resilient individuals.
Studying the resilience-innovation nexus is practically relevant: As resilience is
conducive to more innovative work behaviour – independently of the organization’s
innovation orientation or leadership approach –the hiring of resilient individuals and provision
of employee training for strengthening individual resilience are recommended to any
organization for improving innovation.","Avolio, B.J. & Bass, B.M. (1995). Individual consideration viewed at multiple levels of
analysis: A multilevel framework for examining the diffusion of transformational leadership.
Leadership Quarterly, 6(2), 199-218","Bayus, B. L. (2013). Crowdsourcing new product ideas over time: An analysis of the Dell
IdeaStorm community. Management Science, 59(1), 226-244.","Brandes, U. (2001). A faster algorithm for betweenness centrality. Journal of Mathematical
Sociology, 25(2), 163-177.","Criscuolo, P., Dahlander, L., Grohsjean, T., and Salter, A. (2017). Evaluating novelty: The role
of panels in the selection of RandD projects. Academy of Management Journal, 60(2),
433-460.","De Jong, J. P., von Hippel, E., Gault, F., Kuusisto, J., and Raasch, C. (2015). Market failure in
the diffusion of consumer-developed innovations: Patterns in Finland. Research Policy,
44(10), 1856-1865.","Dougherty, D. (2012). The maker movement. Innovations: Technology, Governance,
Globalization, 7(3), 11-14.","Freeman, L. C. (1978). Centrality in social networks conceptual clarification. Social Networks,
1(3), 215-239.","Gatzweiler, A., Blazevic, V., and Piller, F. T. (2017). Dark side or bright light: Destructive and
constructive deviant content in consumer ideation contests. Journal of Product
Innovation Management, 34(6), 772-789.","Halbinger, M. A. (2018). The role of makerspaces in supporting consumer innovation and
diffusion: An empirical analysis. Research Policy.","Hienerth, C., Lettl, C., and Keinz, P. (2014). Synergies among producer firms, lead users, and
user communities: The case of the LEGO producer–user ecosystem. Journal of Product
Innovation Management, 31(4), 848-866.","Hippel, E. v. (2017). Free Innovation. Cambridge: MIT Press.","Jensen, M. B., Hienerth, C., and Lettl, C. (2014). Forecasting the commercial attractiveness of
user-generated designs using online data: An empirical study within the LEGO user
community. Journal of Product Innovation Management, 31, 75-93.","Kratzer, J., Lettl, C., Franke, N., and Gloor, P. A. (2016). The social network position of lead
users. Journal of Product Innovation Management, 33(2), 201-216.","Lindtner, S. (2015). Hacking with Chinese characteristics: The promises of the maker
movement against China’s manufacturing culture. Science, Technology, Human Values,
40(5), 854-879.","Luo, L., and Toubia, O. (2015). Improving online idea generation platforms and customizing
the task structure on the basis of consumers' domain-specific knowledge. Journal of
Marketing, 79(5), 100-114.","Perry-Smith, J. E., and Mannucci, P. V. (2017). From creativity to innovation: The social
network drivers of the four phases of the idea journey. Academy of Management Review,
42(1), 53-79.","Piezunka, H., and Dahlander, L. (2015). Distant search, narrow attention: How crowding alters
organizations’ filtering of suggestions in crowdsourcing. Academy of Management
Journal, 58(3), 856-880.","Poetz, M. K., and Schreier, M. (2012). The value of crowdsourcing: can users really compete
with professionals in generating new product ideas? Journal of Product Innovation
Management, 29(2), 245-256.","Svensson, P. O., and Hartmann, R. K. (2018). Policies to promote user innovation: Makerspaces
and clinician innovation in Swedish hospitals. Research Policy, 47(1), 277-288.","Wang, C., Rodan, S., Fruin, M., and Xu, X. (2014). Knowledge networks, collaboration
networks, and exploratory innovation. Academy of Management Journal, 57(2), 484-
514.",,,,,,,,,,,,,,,,,,,,,,,,,,,,,,,,,,,,,,,,,,,,,,,,,,,,,,,,,,,,,,,,,,,,,,,,,,,,,,,,,,,
"DELL'ERA, CLAUDIO ","BIANCHI, MATTIA","CALABRETTA, GIULIA ","CANDI, MARINA ","MAGISTRETTI, STEFANO ","STIGLIANI, ILEANA","VERGANTI, ROBERTO",TRANSFORMATIONS BY DESIGN THINKING: EXPLORING THE VALUE OF DESIGN THINKING IN CONSULTING PROJECTS,02. Design Issues and Innovation by Design,"Scholars and practitioners are acknowledging the central role that design can play in innovation (Brown, 2009; Martin, 2009; Verganti, 2009 and 2017; Verganti and Dell’Era, 2014; Liedtka, 2013; Kolko, 2015; Kleinsmann, Valkenburg and Sluijs, 2017). Design is increasingly becoming a strategic source of competitive advantage, to the point that scholars investigate its managerial side and its impact in the creation of value (Capaldo, 2007; Dell’Era and Verganti, 2007 and 2010). Design Thinking, in particular, is making the headlines, with rapid diffusion in practice . Far from being solely about the “form” of products, Design Thinking is accepted as a formal method for creative problem solving, with the intent to foster innovation (Brown, 2009; Martin, 2009; Liedtka, 2015). Accenture, Deloitte, IBM, KPMG, McKinsey and PricewaterhouseCoopers rank among the most active players in acquiring design agencies in order to renew their offerings and refresh their approach. Contemporary Design Thinking is booming in those industries where digital transformation requires new competences and capabilities for developing delightful digital experiences (Calabretta and Kleinsmann, 2017). However, the rapid adoption of Design Thinking in practice has not gone hand-in-hand with a robust development and diffusion of its theoretical underpinnings. On the one hand Design Thinking describes significant transformations highlighting overlaps and synergies with emerging approaches such Design Sprint (Knapp et al., 2016), Agile (Bianchi et al., 2018) or Creative Confidence (Kelley and Kelley, 2010); on the other hand, it is considered a fundamental paradigm to lead digital transformations (Leavy, 2008).
This research uses data collected using a survey that investigates the complex relationships between Design Thinking practices and the value generated. In other words, what are the practices underpinning the generation of value from the adoption of different types of Design Thinking. The collected data are about consulting projects based on Design Thinking and completed in 2018 by European leading consulting firms. The survey is based on different sections and items that have been identified by leveraging both the literature constructs and the iteration performed with managers. Specifically we collected the following data about each consulting project:
 Organizational Setting: team size and configuration considering both the consultant and the client side;
 Goals: objectives addressed by the consulting project;
 Context: context influencing the consulting project;
 Practices: practices adopted during the consulting project;
 Value: value generated by the consulting project considering both the consultant and the client side.
The results show that Design Thinking practices vary significantly depending on the influence provided by the organizational setting, addressed goals and context. This research contributes to both theory and practice by shedding light on the effectiveness of different types of Design Thinking practices and the value generated. This contributes to the existing debate on the Design Thinking practices (Beverland et al., 2015) and perspectives (Micheli et al, 2018). Furthermore, it contributes to the debate among practitioners by showing the value that different practices can generate in consulting projects driven by Design Thinking.","Beverland, M. B., S. J. S. Wilner, and P. Micheli. 2015. Reconciling the tension between consistency and relevance: Design thinking as a mechanism for brand ambidexterity. Journal of the Academy of Marketing Science Vol. 43 No.5, pp. 589–609.","Böhme, R., Christin, N., Edelman, B. and Moore, T., 2015. Bitcoin: Economics, technology, and
governance. Journal of Economic Perspectives, 29(2), pp.213-38.","Caillaud, B., and B. Jullien. 2003. Chicken & egg: Competition among intermediation service providers.
RAND Journal of Economics: 309–328.","Choudary, S.P., G.G. Parker, and M.W. Van Alstyne. 2016. Platform Revolution: How Networked Markets
Are Transforming the Economy and How to Make Them Work for You: WW Norton & Company.","Corbin, J., and A. Strauss. 2008. Basics of qualitative research. 2008.","Evans, D.S. 2003. The antitrust economics of multi-sided platform markets. Yale Journal on
Regulation 20(2): 325-381.","Evans, D.S., and R. Schmalensee. 2016. Matchmakers: The New Economics of Multisided Platforms:
Harvard Business Review Press.","Hagiu, A., and J. Wright. 2015. Multi-sided platforms. International Journal of Industrial Organization 43:
162–174.","Katz, M.L., and C. Shapiro. 1985. Network externalities, competition, and compatibility. The American
Economic Review 75(3): 424-440.","Libert, B., M. Beck, and J. Wind. 2016. The Network Imperative: How to Survive and Grow in the Age of
Digital Business Models: Harvard Business Press Review.","Libert, B., M. Beck, and J. Wind. 2016. The Network Imperative: How to Survive and Grow in the Age of
Digital Business Models: Harvard Business Press Review.","Mazzella, F., A. Sundararajan, V.B. D‘Espous, and M. Möhlmann. 2016. How digital trust powers the
sharing economy. IESE Business Review: 24–31.","McIntyre, D.P., and A. Srinivasan. 2017. Networks, platforms, and strategy: Emerging views and next steps.
Strategic Management Journal 38(1): 141-160.","Miau, S. and Yang, J.M., 2018. Bibliometrics-based evaluation of the Blockchain research trend: 2008–
March 2017. Technology Analysis & Strategic Management, pp.1-17.","Muzellec, L., S. Ronteau, and M. Lambkin. 2015. Two-sided Internet platforms: A business model lifecycle
perspective. Industrial Marketing Management 45(1): 139-150.","Rochet, J.-., and J. Tirole. 2003. Platform competition in two-sided markets. Journal of the European
Economic Association 1(4): 990-1029.","Saldaña, J. 2015. The coding manual for qualitative researchers: Sage.","Stummer, C., D. Kundisch, and R. Decker. 2018. Platform Launch Strategies. Business & Information
Systems Engineering: 1-7.","Sun, M., and E. Tse. 2009. The resource-based view of competitive advantage in two-sided markets. Journal
of Management Studies 46(1): 45-64.","Täuscher, K., and S.M. Laudien. 2018. Understanding platform business models: A mixed methods study of
marketplaces. European Management Journal 36(3): 319-329.","Trabucchi, D., T. Buganza, and E. Pellizzoni. 2017. Give away your digital services: leveraging big data to
capture value. Research Technology Management 60(2): 43-52.","Wood, G. 2014. “ETHEREUM: A Secure Decentralised Generalised Transaction Ledger.” Ethereum Project
Yellow Paper. Accessed October 31st, 2018.
https://pdfs.semanticscholar.org/ac15/ea808ef3b17ad754f91d3a00fedc8f96b929.pdf.","Yin, R.K. 2013. Case study research: Design and methods: Sage publications.",,,,,,,,,,,,,,,,,,,,,,,,,,,,,,,,,,,,,,,,,,,,,,,,,,,,,,,,,,,,,,,,,,,,,,,,,,,,,,,,
"MAGISTRETTI, STEFANO ","DELL'ERA, CLAUDIO ","GASTALDI, LUCA","VERGANTI, ROBERTO",,,,ADOPTION AND VALUE OF DESIGN THINKING: A CROSS-INDUSTRY AND EXTENSIVE ANALYSIS OF THE ITALIAN MARKET,02. Design Issues and Innovation by Design,,,"Christopher, M., Lowson, R. & Peck, H., 2004. Creating agile supply chains in the fashion industry. International Journal of Retail and Distribution Management, 32(8), pp.367–376.","Clelands, D. & Ireland, L., 2002. Project Management: strategic design and implementation 4th ed., New York: McGraw-Hill Ltd.","Cooper, R.G. & Kleinschmidt, E.J., 1995. New product performance: Keys to success, profitability & cycle time reduction. Journal of Marketing Management, 11(June), pp.315–337.","d’Avolio, E., Bandinelli, R. & Rinaldi, R., 2015. Improving new product development in the fashion industry through product lifecycle management: a descriptive analysis. International Journal of Fashion Design, Technology and Education, 8(April), pp.108–121.","Doyle, S.A., Moore, C.M. & Morgan, L., 2006. Supplier management in fast moving fashion retailing. Journal of Fashion Marketing and Management : An International Article information :, 10(3), pp.272–281.","Goworek, H., 2010. An investigation into fashion product development processes for UK fashion retailers: A multiple case study. Journal of Fashion Marketing and Management : An International Article information :, 14(4), pp.648–662.","Goworek, H., 2014. An investigation into retail buying roles and responsibilities for own-label clothing: a multiple case-study. Journal of the Textile Institute, 105(October), pp.760–769.","Hart, S., 1996. New Product Development S. Hart, ed., London: The Dryden Press.
Johne, A. & Snelson, P., 1988. Success Factors in Product Innovation: A Selective Review of the Literature. Journal of Product Innovation Management, 5, pp.114–128.","Krishnan, V. & Ulrich, K.T., 2001. Product Development Decisions: A Review of the Literature. Management Science, 47, pp.1–21.","Lock, D., 2013. Project Management 10th ed., Surrey: Gower Publishing Ltd.
Major, H., 2010. Project Mangement 4th ed., Essex: Pearson Education Ltd.
McCormick, H. et al., 2014. Fashion retailing – past, present and future. Textile Progress, 46(3), pp.227–321.","Moretti, I.C. & Braghini Junior, A., 2017. Reference model for apparel product development. Independent Journal of Management & Production, 8(1), pp.232–262.","Packendorff, J., 1995. Inquiring into the temporary organization: New directions for project management research. Scandinavian Journal of Management, 11(4), pp.319–333.","Pechoux, B. Le, Little, T.J. & Istook, C., 2004. Innovation management in creating new
fashions. In T. Hines & M. Bruce, eds. Fashion Marketing Contemporary Issues. Oxford: Elsevier Butterworth-Heinemann, pp. 136–164.","Silva, R. & Rupasinghe, T., 2016. Characterization of new product development NPD models applicable to enhance the overall performance of the apparel industry. International Journal of Textile and Fashion Technology, 6(3), pp.1–14.","Soderlund, J., 2004. Building theories of project management: Past research, questions for the future. International Journal of Project Management, 22(3), pp.183–191.","Tyler, D., Heeley, J. & Bhamra, T., 2006. Supply chain influences on new product development in fashion clothing . Journal of Fashion Marketing and Management : An International Article information :, 10(3), pp.316–328.",,,,,,,,,,,,,,,,,,,,,,,,,,,,,,,,,,,,,,,,,,,,,,,,,,,,,,,,,,,,,,,,,,,,,,,,,,,,,,,,,,,,,,
"MAGISTRETTI, STEFANO ","DELL'ERA, CLAUDIO ",,,,,,EMPOWERING DESIGN THINKING WITH DIGITAL TECHNOLOGIES,02. Design Issues and Innovation by Design,"Technologies are spread in the world, and with the advent of the digital world, their
presence in our daily life is booming (Nambisan et al., 2017). In the last decades,
several different digital technologies are changing the way people live, and the way
the company develops new products and services. Indeed, digital technologies such
as Artificial Intelligence, Big Data and Blockchain are just a few of the innovations
that are disrupting the society (Williams and Edge, 1996). This is happening at both
the society and corporate level. As a matter of fact, companies not only are
struggling in understanding how can digital technologies be adequately developed in
order to be adopted and accepted by the humans but they are also fighting in
comprehending the potentiality that digital technologies can bring to the innovation
processes (Dell’Era et al, 2017; Dannells and Frattini, 2018).
In particular, the paper focuses on this second avenue of research. In particular, it
considers not all innovation processes but the one that positions the human at the
center (Beckman and Barry, 2007; Brown, 2008). Indeed, academics and practitioners
are giving to these approaches growing attention (Verganti, 2017; Micheli et al.,
2018). Different systematic literature reviews on the topic are emerging
(Johansson-Sköldberg et al., 2013; Liedtka, 2015; Cettindamar, 2017; CMR, 2018). All of
them are aiming at understanding more about design thinking and its power for the
innovation processes. What they are not focusing on adequately, as far as the author
knowledge, is the role that digital technologies can have in the design thinking
projects.
Accordingly, the paper aims at answering the following research question: how can
companies integrate fruitfully digital technologies in design thinking projects. So, the
case study methodology appears to be the most appropriate approach in order to
explore the research mentioned above problem because it is particularly indicated to
answer to ""how"" questions and to investigate complex phenomena (Yin, 2011).
Indeed, considering the multifaceted aspect of this topic, an exploratory case study
research can help in shedding light on it. In particular, we adopted a literal replication
of cases of companies adopting digital technologies in managing and developing
design thinking projects. In other words, the focus of the research is to investigate
first which are the digital technologies that can be adopted in this particular kind of
innovation processes. Second is to understand in which moments of the process they
are useful and finally to comprehend how these technologies can be integrated into
the projects. Leveraging ten real design thinking projects that were performed
during the last two years the paper provides evidence on how different digital
technologies can transform the design thinking processes.
The results of the analysis show that digital technologies are of first help in the front
end of the design thinking process where the market usually is unknown, and the
technology such as data mining and big data analytics can help managers and
practitioners in knowing more the future adopters. Moreover, it shows how
creativity can be boosted through the adoption of digital technologies. For example,
Artificial Intelligence technologies such as Chef Watson are an example of how AI can
support the creativity by proposing different combinations of ingredients by
analyzing tons of data in a matter second. Finally, the paper proposes a series of
hypothesis that emerges from the integration of the digital evidence with the
process of design thinking. This is of primary interest of both academics and
practitioners due to the value that the contributions propose to the two
communities. On the one hand, it sheds light on the ongoing debate of the digital
technology streams of literature (Micheli et al., 2018) by showing how they can also
contribute to a new way of managing innovations (Knapp et al., 2017; Natalicchio et
al., 2017). On the other hand, it provides managers with insights on how to adopt
digital technologies in the process from a practical perspective.","Beckman, S. L., & Barry, M. (2007). Innovation as a learning process: Embedding design
thinking. California management review, 50(1), 25-56.","Davies, A., Brady, T., Prencipe, A., Hobday, M. (2011), Innovation in Complex Products and Systems:
Implications for Project-Based Organizing, in Cattani, G., Ferriani, S., Frederiksen, L., Täube, F.,
(ed.) Project-Based Organizing and Strategic Management (Advances in Strategic Management,
Volume 28) Emerald Group Publishing Limited, pp. 3 – 26.","Dedehayir, O., Nokelainen, T., Mäkinen, S. (2014) Disruptive innovations in complex product systems
industries: A case study, Journal of Engineering and Technology Management, Vol 33, pp. 175-192.","Dombrowski, P. and Gholz, E. (2006), Buying Military Transformation –Technological Innovation and the
Defense Industry, New York: Columbia University Press.","Hobday, M. (1997) Product complexity, innovation and industrial organization, Research Policy, Vol. 26,
No. 6, pp. 689-710.","Katz, M. and Shapiro, C. (1994), Systems Competition and Network Effects, Journal of Economic
Perspectives, Vol. 8, No. 2, pp. 93-115.","Khurana, A. and Rosenthal, S. (1998), Towards Holistic ""Front Ends In New Product Development,
Journal of Product Innovation management, Vol. 15, No.1, pp. 57-74.","Walker, W. (2000), Entrapment in large technology systems: institutional commitment and power relations,
Research Policy, Vol. 29, No. 7-8, pp. 833-846.",,,,,,,,,,,,,,,,,,,,,,,,,,,,,,,,,,,,,,,,,,,,,,,,,,,,,,,,,,,,,,,,,,,,,,,,,,,,,,,,,,,,,,,,,,,,,,,
